{
  "backend_id": "qaoa-hardware",
  "display_name": "QAOA (Quantum Hardware)",
  "backend_category": "quantum_hardware",
  "implementation_language": "Python",
  "determinism_class": "Stochastic (non-reproducible)",
  "specification_version": 1,
  "supported_size_classes": ["Small"],
  "supports_time_windows": false,
  "supports_capacity_constraints": true,
  "latency_profile": {
    "Small": "TBD"
  },
  "quality_profile": "Baseline",
  "cost_profile": "TBD",
  "is_provisional": true,
  "supported_contract_version": 1
}
