{
  "backend_id": "greedy-insertion",
  "display_name": "Greedy Insertion Heuristic",
  "backend_category": "classical_deterministic",
  "implementation_language": "C++",
  "determinism_class": "Deterministic",
  "specification_version": 1,
  "supported_size_classes": ["Small", "Medium", "Large"],
  "supports_time_windows": false,
  "supports_capacity_constraints": true,
  "latency_profile": {
    "Small": 0.010,
    "Medium": 0.100,
    "Large": 1.000
  },
  "quality_profile": "Competitive",
  "cost_profile": 1,
  "is_provisional": true,
  "supported_contract_version": 1
}
